{
  "schema_version": "combat-input-v1",
  "metadata": {
    "name": "Celeborn aura: shielded Galadhrim plus two Court Guard vs supported infantry",
    "ruleset": "MESBG 2024",
    "faq_current_to": "2026-07-03",
    "assumptions": [
      "Side A front is D6 and physically trapped if it loses",
      "Both Court Guard supports and the front model are inside Celeborn's aura",
      "Side B has lower Fight, two Duel dice, two S3 Strikes, and no banner"
    ]
  },
  "duel": {
    "side_a": {
      "dice": [
        {"id": "front", "count": 1, "fight": 5},
        {"id": "court_guard", "count": 2, "fight": 6}
      ]
    },
    "side_b": {
      "dice": [
        {"id": "enemy", "count": 2, "fight": 4}
      ]
    },
    "equal_fight_a_win_probability": "2/3",
    "reroll_order": [],
    "might_order": []
  },
  "branches": {
    "if_a_wins": {
      "strikes": [
        {"id": "front", "count": 1, "strength": 3, "modifier": 1},
        {"id": "court_guard", "count": 2, "strength": 3, "modifier": 1}
      ],
      "target": {"defence": 5, "wounds": 1}
    },
    "if_b_wins": {
      "strikes": [
        {"id": "enemy", "count": 2, "strength": 3}
      ],
      "target": {"defence": 6, "wounds": 1, "trapped": true, "prone": false}
    }
  }
}
